{
  "$schema": "../schemas/fusion-drive.schema.json",
  "active_profile": "xai-claude-oauth",
  "auto_eval": {
    "enabled": true,
    "standalone_html": true,
    "embedded_svg": true,
    "external_assets": false,
    "quantstats": false,
    "deterministic": true,
    "canonical_sorted_json_input": true,
    "intelligence_contribution_requires_pinned_ablation": true,
    "dimensions": [
      "workflow_graph",
      "api_spend",
      "subscription_usage",
      "efficiency",
      "settings_changes",
      "failures",
      "gate_grades",
      "tool_errors",
      "hallucinations",
      "honesty",
      "over_reasoning",
      "under_reasoning",
      "model_intelligence_contribution"
    ]
  },
  "batching": {
    "default_mode": "bounded_microbatch",
    "shared_prompt_prefix": true,
    "prompt_cache_keys": true,
    "subscription_concurrency": 1,
    "max_batch_items": 50,
    "provider_async_requires_explicit_confirmation": true,
    "ambiguous_outcome_retry": false,
    "cost_claim_policy": "only_provider_documented_discounts"
  },
  "engines": {
    "all_grok_4_5": {
      "kind": "client_orchestrated",
      "panel": [
        "all-grok-panel-a",
        "all-grok-panel-b"
      ],
      "optional_panel": [],
      "judge": "all-grok-judge",
      "fuser": "all-grok-fuser",
      "min_live_seats": 2,
      "max_concurrency": 2,
      "independent_first_pass": true,
      "anonymize_model_identity": true,
      "prohibit_majority_vote": true,
      "preserve_minority_findings": true,
      "max_fusion_depth": 1
    },
    "exaflop_mini": {
      "anonymize_model_identity": true,
      "fuser": "grok45-mini-fuser",
      "independent_first_pass": true,
      "judge": "grok45-xr-review",
      "kind": "client_orchestrated",
      "max_concurrency": 2,
      "max_fusion_depth": 1,
      "min_live_seats": 2,
      "optional_panel": [],
      "panel": [
        "grok45-xr-mini-panel",
        "sol-xr-mini-panel"
      ],
      "preserve_minority_findings": true,
      "prohibit_majority_vote": true
    },
    "exaflop_reactor": {
      "anonymize_model_identity": true,
      "fuser": "fable5-oauth-fuser",
      "independent_first_pass": true,
      "judge": "all-grok-judge",
      "kind": "client_orchestrated",
      "max_concurrency": 3,
      "max_fusion_depth": 1,
      "min_live_seats": 3,
      "optional_panel": [],
      "panel": [
        "sol-xr-panel-a",
        "sol-xr-panel-b",
        "fable5-oauth-panel"
      ],
      "preserve_minority_findings": true,
      "prohibit_majority_vote": true
    },
    "in_harness": {
      "kind": "client_orchestrated",
      "panel": [
        "grok45-panel",
        "gpt56sol-panel",
        "fable5-panel"
      ],
      "optional_panel": [],
      "judge": "gpt56sol-judge",
      "fuser": "gpt56sol-fuser",
      "min_live_seats": 3,
      "max_concurrency": 3,
      "independent_first_pass": true,
      "anonymize_model_identity": true,
      "prohibit_majority_vote": true,
      "preserve_minority_findings": true,
      "max_fusion_depth": 1
    },
    "mini_fuse": {
      "anonymize_model_identity": true,
      "fuser": "grok45-mini-fuser",
      "independent_first_pass": true,
      "judge": "grok45-mini-judge",
      "kind": "client_orchestrated",
      "max_concurrency": 1,
      "max_fusion_depth": 1,
      "min_live_seats": 1,
      "optional_panel": [],
      "panel": [
        "grok45-mini-panel"
      ],
      "preserve_minority_findings": true,
      "prohibit_majority_vote": true
    },
    "openrouter_fusion": {
      "kind": "server_managed",
      "enabled": true,
      "seat": "openrouter-fusion-seat",
      "analysis_models": [
        "x-ai/grok-4.5",
        "openai/gpt-5.6-sol",
        "anthropic/claude-fable-5"
      ],
      "judge_model": "openai/gpt-5.6-sol",
      "reasoning": "xhigh",
      "fallback_engine": "in_harness",
      "inherit_in_harness_settings": false,
      "max_fusion_depth": 1
    },
    "subscription_oauth": {
      "kind": "client_orchestrated",
      "panel": [
        "grok45-oauth-panel",
        "grok45-oauth-panel-b",
        "fable5-oauth-panel"
      ],
      "optional_panel": [],
      "judge": "grok45-oauth-judge",
      "fuser": "fable5-oauth-fuser",
      "min_live_seats": 3,
      "max_concurrency": 2,
      "independent_first_pass": true,
      "anonymize_model_identity": true,
      "prohibit_majority_vote": true,
      "preserve_minority_findings": true,
      "max_fusion_depth": 1
    },
    "xai_claude_oauth": {
      "kind": "client_orchestrated",
      "panel": [
        "all-grok-panel-a",
        "all-grok-panel-b",
        "fable5-oauth-panel"
      ],
      "optional_panel": [],
      "judge": "all-grok-judge",
      "fuser": "fable5-oauth-fuser",
      "min_live_seats": 3,
      "max_concurrency": 3,
      "independent_first_pass": true,
      "anonymize_model_identity": true,
      "prohibit_majority_vote": true,
      "preserve_minority_findings": true,
      "max_fusion_depth": 1
    }
  },
  "gate_sets": {
    "approval-gates": {
      "enabled": true,
      "fail_closed": true,
      "reviewers": [
        "grok45-gate-primary",
        "grok45-gate-secondary"
      ],
      "required_passes": 2,
      "max_concurrency": 2,
      "max_revision_cycles": 2,
      "requested_reasoning": "xhigh",
      "effective_reasoning": "high",
      "normalization": "provider_ceiling",
      "stages": {
        "synthesis": {
          "owner": "fusion_engine",
          "automatic": true,
          "required_evidence": [
            "panel_artifacts",
            "judge_artifact",
            "synthesis_hash"
          ]
        },
        "plan": {
          "owner": "codex_host",
          "automatic": false,
          "required_evidence": [
            "requirements_trace",
            "risk_analysis",
            "workflow_report"
          ]
        },
        "pre_execution": {
          "owner": "codex_host",
          "automatic": false,
          "required_evidence": [
            "confirmed_plan",
            "goal_receipt",
            "scope_boundaries"
          ]
        },
        "subagent_pre_execution": {
          "owner": "codex_host",
          "automatic": false,
          "required_evidence": [
            "subagent_scope",
            "preset_hash"
          ]
        },
        "subagent_post_execution": {
          "owner": "codex_host",
          "automatic": false,
          "required_evidence": [
            "subagent_result",
            "tool_errors",
            "verification"
          ]
        },
        "post_execution": {
          "owner": "codex_host",
          "automatic": false,
          "required_evidence": [
            "diff",
            "tests",
            "requirement_coverage"
          ]
        },
        "final": {
          "owner": "codex_host",
          "automatic": false,
          "required_evidence": [
            "gate_verdict",
            "cost_ledger",
            "provenance"
          ]
        },
        "summarize": {
          "owner": "codex_host",
          "automatic": false,
          "required_evidence": [
            "decisions",
            "open_risks",
            "verification_state"
          ]
        }
      }
    },
    "oauth-approval-gates": {
      "enabled": true,
      "fail_closed": true,
      "reviewers": [
        "grok45-oauth-gate-primary",
        "grok45-oauth-gate-secondary"
      ],
      "required_passes": 2,
      "max_concurrency": 1,
      "max_revision_cycles": 2,
      "requested_reasoning": "xhigh",
      "effective_reasoning": "high",
      "normalization": "provider_ceiling",
      "stages": {
        "synthesis": {
          "owner": "fusion_engine",
          "automatic": true,
          "required_evidence": [
            "panel_artifacts",
            "judge_artifact",
            "synthesis_hash"
          ]
        },
        "plan": {
          "owner": "codex_host",
          "automatic": false,
          "required_evidence": [
            "requirements_trace",
            "risk_analysis",
            "workflow_report"
          ]
        },
        "pre_execution": {
          "owner": "codex_host",
          "automatic": false,
          "required_evidence": [
            "confirmed_plan",
            "goal_receipt",
            "scope_boundaries"
          ]
        },
        "subagent_pre_execution": {
          "owner": "codex_host",
          "automatic": false,
          "required_evidence": [
            "subagent_scope",
            "preset_hash"
          ]
        },
        "subagent_post_execution": {
          "owner": "codex_host",
          "automatic": false,
          "required_evidence": [
            "subagent_result",
            "tool_errors",
            "verification"
          ]
        },
        "post_execution": {
          "owner": "codex_host",
          "automatic": false,
          "required_evidence": [
            "diff",
            "tests",
            "requirement_coverage"
          ]
        },
        "final": {
          "owner": "codex_host",
          "automatic": false,
          "required_evidence": [
            "gate_verdict",
            "cost_ledger",
            "provenance"
          ]
        },
        "summarize": {
          "owner": "codex_host",
          "automatic": false,
          "required_evidence": [
            "decisions",
            "open_risks",
            "verification_state"
          ]
        }
      }
    },
    "xai-serialized-approval-gates": {
      "enabled": true,
      "fail_closed": true,
      "reviewers": [
        "grok45-gate-primary",
        "grok45-gate-secondary"
      ],
      "required_passes": 2,
      "max_concurrency": 1,
      "max_revision_cycles": 2,
      "requested_reasoning": "xhigh",
      "effective_reasoning": "high",
      "normalization": "provider_ceiling",
      "stages": {
        "synthesis": {
          "owner": "fusion_engine",
          "automatic": true,